Имя монарха,Дата пребывания,Место пребывания,Источник
Карл IX,28 октября 1573 ,Вилле-Коттре (Villers-Cotter?ts) ,Ответное письмо на требования гугенотов Лангедока / РНБ. ОР. Авт. 21/1; № 50
Карл IX,12 декабря 1573,Париж; Лувр,Письмо неустановленному лицу («Mon cousin…») / РНБ. ОР. Ф. 993. Оп. 2: Собрание автографов П.К. Сухтелена. Франция. № 34.
Карл IX,1573,Без места,Письмо герцогу Анжуйскому / РНБ. ОР. Авт. 21/2; № 60.	
Карл IX,16 января 1574,Замок Сен-Жермен-ан-Ле,Приказ специальному казначею Гиени / РНБ. ОР. Ф. 992. Оп. 1. Собрание иностранных актов и грамот. № 140.
Карл IX,25 апреля 1574 ,Венсеннский замок,Письмо французскому послу в Швейцарии сеньору д’Отфору (Hautefort) / РНБ. ОР. Авт. 21/1; № 51,